{
  "category1": "example_value",
  "category2": "example_value",
  "category3": "example_value",
  "category4": "example_value",
  "category5": "example_value",
  "category6": "example_value",
  "category7": "example_value",
  "category8": "example_value",
  "category9": "example_value",
  "category10": "example_value",
  "category11": "example_value",
  "category12": "example_value",
  "category13": "example_value",
  "category14": "example_value",
  "category15": "example_value",
  "category16": "example_value",
  "category17": "example_value",
  "category18": "example_value",
  "category19": "example_value",
  "category20": "example_value",
  "category21": "example_value",
  "category22": "example_value",
  "category23": "example_value",
  "category24": "example_value",
  "category25": "example_value"
}